bill_id,session_id,bill_number,status,status_desc,status_date,title,description,committee_id,committee,last_action_date,last_action,url,state_link
1473239,1806,LD870,4,Passed,2021-06-03,"Resolve, Directing the Permanent Commission on the Status of Racial, Indigenous and Maine Tribal Populations To Study the Impact of Policies Regarding Agriculture, Access to Land, Access to Grants and Access to Financing on African American and Indigenous Farmers in the State","Resolve, Directing the Permanent Commission on the Status of Racial, Indigenous and Maine Tribal Populations To Study the Impact of Policies Regarding Agriculture, Access to Land, Access to Grants and Access to Financing on African American and Indigenous Farmers in the State",0,,2021-06-03,"FINALLY PASSED, in concurrence.",https://legiscan.com/ME/bill/LD870/2021,https://legislature.maine.gov/legis/bills/display_ps.asp?LD=870&snum=130
1473802,1806,LD871,4,Passed,2021-06-18,"An Act To Clarify Certain Provisions Regarding the Marijuana Excise Tax","An Act To Clarify Certain Provisions Regarding the Marijuana Excise Tax",0,,2021-06-18,"PASSED TO BE ENACTED - Emergency - 2/3 Elected Required, in concurrence.",https://legiscan.com/ME/bill/LD871/2021,https://legislature.maine.gov/legis/bills/display_ps.asp?LD=871&snum=130
1473793,1806,LD872,4,Passed,2021-06-03,"An Act Concerning Motor Vehicle Emissions Control System Tampering","An Act Concerning Motor Vehicle Emissions Control System Tampering",0,,2021-06-03,"PASSED TO BE ENACTED, in concurrence.",https://legiscan.com/ME/bill/LD872/2021,https://legislature.maine.gov/legis/bills/display_ps.asp?LD=872&snum=130
1473314,1806,LD885,4,Passed,2021-06-08,"An Act To Promote Bulk Retail Purchasing","An Act To Promote Bulk Retail Purchasing",0,,2021-06-08,"PASSED TO BE ENACTED, in concurrence.",https://legiscan.com/ME/bill/LD885/2021,https://legislature.maine.gov/legis/bills/display_ps.asp?LD=885&snum=130
1473670,1806,LD886,6,Failed,2022-05-09,"Resolve, To Encourage Employment in the Direct Care Workforce","Resolve, To Encourage Employment in the Direct Care Workforce",0,,2022-05-09,"In possession of the Senate when the Legislature adjourned Sine Die and was placed in the Legislative Files. (DEAD)",https://legiscan.com/ME/bill/LD886/2021,https://legislature.maine.gov/legis/bills/display_ps.asp?LD=886&snum=130
1473619,1806,LD887,6,Failed,2021-06-15,"An Act To Require Uniform Adherence to Internal Revenue Service Guidelines by Maine Nonprofit Organizations","An Act To Require Uniform Adherence to Internal Revenue Service Guidelines by Maine Nonprofit Organizations",0,,2021-06-15,"Placed in Legislative Files (DEAD)",https://legiscan.com/ME/bill/LD887/2021,https://legislature.maine.gov/legis/bills/display_ps.asp?LD=887&snum=130
1473633,1806,LD888,6,Failed,2021-04-28,"An Act To Ensure Ongoing Services for Victims of Sexual Assault and Domestic Violence","An Act To Ensure Ongoing Services for Victims of Sexual Assault and Domestic Violence",0,,2021-04-28,"Pursuant to Joint Rule 310.3 Placed in Legislative Files (DEAD)",https://legiscan.com/ME/bill/LD888/2021,https://legislature.maine.gov/legis/bills/display_ps.asp?LD=888&snum=130
1473301,1806,LD889,6,Failed,2021-04-28,"An Act Concerning Proportional Representation","An Act Concerning Proportional Representation",0,,2021-04-28,"Pursuant to Joint Rule 310.3 Placed in Legislative Files (DEAD)",https://legiscan.com/ME/bill/LD889/2021,https://legislature.maine.gov/legis/bills/display_ps.asp?LD=889&snum=130
1473683,1806,LD890,6,Failed,2021-06-02,"An Act To Protect Maine Consumers and Decrease Environmental Pollution","An Act To Protect Maine Consumers and Decrease Environmental Pollution",0,,2021-06-02,"Pursuant to Joint Rule 310.3 Placed in Legislative Files (DEAD)",https://legiscan.com/ME/bill/LD890/2021,https://legislature.maine.gov/legis/bills/display_ps.asp?LD=890&snum=130
1473514,1806,LD891,6,Failed,2021-06-07,"An Act To Eliminate or Forgive Fines and Penalties on Persons and Businesses Due to the COVID-19 Pandemic","An Act To Eliminate or Forgive Fines and Penalties on Persons and Businesses Due to the COVID-19 Pandemic",0,,2021-06-07,"Placed in Legislative Files (DEAD)",https://legiscan.com/ME/bill/LD891/2021,https://legislature.maine.gov/legis/bills/display_ps.asp?LD=891&snum=130
1473585,1806,LD892,6,Failed,2022-03-09,"An Act To Implement the Recommendations of the Governor's Economic Recovery Committee","An Act To Implement the Recommendations of the Governor's Economic Recovery Committee",0,,2022-03-09,"Pursuant to Joint Rule 310.3 Placed in Legislative Files (DEAD)",https://legiscan.com/ME/bill/LD892/2021,https://legislature.maine.gov/legis/bills/display_ps.asp?LD=892&snum=130
1473414,1806,LD893,6,Failed,2021-05-19,"An Act To Enable Motor Vehicle Technicians To Safely Disable Breathalyzer Starter Devices","An Act To Enable Motor Vehicle Technicians To Safely Disable Breathalyzer Starter Devices",0,,2021-05-19,"Pursuant to Joint Rule 310.3 Placed in Legislative Files (DEAD)",https://legiscan.com/ME/bill/LD893/2021,https://legislature.maine.gov/legis/bills/display_ps.asp?LD=893&snum=130
1473370,1806,LD894,4,Passed,2021-06-07,"An Act To Increase Government Accountability by Removing the Restriction on the Dissemination of Information Regarding Investigations","An Act To Increase Government Accountability by Removing the Restriction on the Dissemination of Information Regarding Investigations",0,,2021-06-07,"PASSED TO BE ENACTED, in concurrence.",https://legiscan.com/ME/bill/LD894/2021,https://legislature.maine.gov/legis/bills/display_ps.asp?LD=894&snum=130
1473358,1806,LD895,4,Passed,2022-01-05,"An Act Regarding the Apportionment of the Franklin County Commissioner Districts","An Act Regarding the Apportionment of the Franklin County Commissioner Districts",0,,2022-01-05,"PASSED TO BE ENACTED - Emergency - 2/3 Elected Required, in concurrence.",https://legiscan.com/ME/bill/LD895/2021,https://legislature.maine.gov/legis/bills/display_ps.asp?LD=895&snum=130
1473782,1806,LD896,6,Failed,2022-05-09,"Resolve, Directing the Department of Education To Study Disciplinary Policies","Resolve, Directing the Department of Education To Study Disciplinary Policies",0,,2022-05-09,"In possession of the Senate when the Legislature adjourned Sine Die and was placed in the Legislative Files. (DEAD)",https://legiscan.com/ME/bill/LD896/2021,https://legislature.maine.gov/legis/bills/display_ps.asp?LD=896&snum=130
1473319,1806,LD897,4,Passed,2021-06-03,"An Act To Allow Municipalities To Set Below-market Interest Rates for Senior Citizen Property Tax Deferral Programs","An Act To Allow Municipalities To Set Below-market Interest Rates for Senior Citizen Property Tax Deferral Programs",0,,2021-06-03,"PASSED TO BE ENACTED, in concurrence.",https://legiscan.com/ME/bill/LD897/2021,https://legislature.maine.gov/legis/bills/display_ps.asp?LD=897&snum=130
1473485,1806,LD898,4,Passed,2022-04-25,"An Act To Create the Essential Support Workforce Advisory Committee","An Act To Create the Essential Support Workforce Advisory Committee",0,,2022-04-25,"Subsequently PASSED TO BE ENACTED in concurrence",https://legiscan.com/ME/bill/LD898/2021,https://legislature.maine.gov/legis/bills/display_ps.asp?LD=898&snum=130
1473580,1806,LD899,6,Failed,2022-02-10,"An Act To Protect Privacy and Security at the Bureau of Motor Vehicles","An Act To Protect Privacy and Security at the Bureau of Motor Vehicles",0,,2022-02-10,"Pursuant to Joint Rule 310.3 Placed in Legislative Files (DEAD)",https://legiscan.com/ME/bill/LD899/2021,https://legislature.maine.gov/legis/bills/display_ps.asp?LD=899&snum=130
1473470,1806,LD900,6,Failed,2021-06-15,"An Act To Facilitate the Recycling of Clean Energy Equipment","An Act To Facilitate the Recycling of Clean Energy Equipment",0,,2021-06-15,"Placed in Legislative Files (DEAD)",https://legiscan.com/ME/bill/LD900/2021,https://legislature.maine.gov/legis/bills/display_ps.asp?LD=900&snum=130
1473218,1806,LD901,6,Failed,2021-06-02,"An Act To Assist Maine Residents Negatively Affected by Climate Change","An Act To Assist Maine Residents Negatively Affected by Climate Change",0,,2021-06-02,"Pursuant to Joint Rule 310.3 Placed in Legislative Files (DEAD)",https://legiscan.com/ME/bill/LD901/2021,https://legislature.maine.gov/legis/bills/display_ps.asp?LD=901&snum=130
1473644,1806,LD902,6,Failed,2021-05-19,"An Act To Enact the Uniform Registration of Canadian Money Judgments Act","An Act To Enact the Uniform Registration of Canadian Money Judgments Act",0,,2021-05-19,"Pursuant to Joint Rule 310.3 Placed in Legislative Files (DEAD)",https://legiscan.com/ME/bill/LD902/2021,https://legislature.maine.gov/legis/bills/display_ps.asp?LD=902&snum=130
1473736,1806,LD903,4,Passed,2022-04-25,"An Act To Enact the Uniform Foreign-country Money Judgments Recognition Act and the Uniform Registration of Canadian Money Judgments Act","An Act To Enact the Uniform Foreign-country Money Judgments Recognition Act and the Uniform Registration of Canadian Money Judgments Act",0,,2022-04-25,"Subsequently PASSED TO BE ENACTED in concurrence",https://legiscan.com/ME/bill/LD903/2021,https://legislature.maine.gov/legis/bills/display_ps.asp?LD=903&snum=130
1473445,1806,LD904,6,Failed,2021-06-02,"An Act Concerning the Revised Uniform Law on Notarial Acts","An Act Concerning the Revised Uniform Law on Notarial Acts",0,,2021-06-02,"Pursuant to Joint Rule 310.3 Placed in Legislative Files (DEAD)",https://legiscan.com/ME/bill/LD904/2021,https://legislature.maine.gov/legis/bills/display_ps.asp?LD=904&snum=130
1473652,1806,LD905,6,Failed,2021-05-19,"An Act To Enact the Uniform Voidable Transactions Act","An Act To Enact the Uniform Voidable Transactions Act",0,,2021-05-19,"Pursuant to Joint Rule 310.3 Placed in Legislative Files (DEAD)",https://legiscan.com/ME/bill/LD905/2021,https://legislature.maine.gov/legis/bills/display_ps.asp?LD=905&snum=130
1473755,1806,LD906,4,Passed,2022-04-14,"An Act To Provide Passamaquoddy Tribal Members Access to Clean Drinking Water","An Act To Provide Passamaquoddy Tribal Members Access to Clean Drinking Water",0,,2022-04-19,"PASSED TO BE ENACTED, in concurrence.",https://legiscan.com/ME/bill/LD906/2021,https://legislature.maine.gov/legis/bills/display_ps.asp?LD=906&snum=130
1473646,1806,LD907,6,Failed,2022-03-24,"An Act Concerning State Pension Funds and Climate Change","An Act Concerning State Pension Funds and Climate Change",0,,2022-03-24,"Pursuant to Joint Rule 310.3 Placed in Legislative Files (DEAD)",https://legiscan.com/ME/bill/LD907/2021,https://legislature.maine.gov/legis/bills/display_ps.asp?LD=907&snum=130
1473730,1806,LD908,6,Failed,2021-05-19,"An Act To Protect Maine Residents and Organizations from Unreasonable and Illegal Surveillance, Monitoring or Tracking","An Act To Protect Maine Residents and Organizations from Unreasonable and Illegal Surveillance, Monitoring or Tracking",0,,2021-05-19,"Pursuant to Joint Rule 310.3 Placed in Legislative Files (DEAD)",https://legiscan.com/ME/bill/LD908/2021,https://legislature.maine.gov/legis/bills/display_ps.asp?LD=908&snum=130
1473402,1806,LD909,4,Passed,2021-06-09,"An Act Regarding the Depth of Phillips Lake in the Town of Dedham","An Act Regarding the Depth of Phillips Lake in the Town of Dedham",0,,2021-06-09,"PASSED TO BE ENACTED - Emergency - 2/3 Elected Required, in concurrence.",https://legiscan.com/ME/bill/LD909/2021,https://legislature.maine.gov/legis/bills/display_ps.asp?LD=909&snum=130
1473608,1806,LD910,4,Passed,2022-04-25,"An Act To Amend the General Assistance Laws Governing Reimbursement","An Act To Amend the General Assistance Laws Governing Reimbursement",0,,2022-04-25,"PASSED TO BE ENACTED, in concurrence.",https://legiscan.com/ME/bill/LD910/2021,https://legislature.maine.gov/legis/bills/display_ps.asp?LD=910&snum=130
1473743,1806,LD911,6,Failed,2021-06-09,"An Act To Prohibit the Reception of Foreign Waste Plastic in Maine Ports","An Act To Prohibit the Reception of Foreign Waste Plastic in Maine Ports",0,,2021-06-09,"Placed in Legislative Files (DEAD)",https://legiscan.com/ME/bill/LD911/2021,https://legislature.maine.gov/legis/bills/display_ps.asp?LD=911&snum=130
1473697,1806,LD912,4,Passed,2022-04-25,"An Act To Extend Family Medical Leave to Hourly School Employees","An Act To Extend Family Medical Leave to Hourly School Employees",0,,2022-04-25,"Subsequently PASSED TO BE ENACTED in concurrence",https://legiscan.com/ME/bill/LD912/2021,https://legislature.maine.gov/legis/bills/display_ps.asp?LD=912&snum=130
1473436,1806,LD913,4,Passed,2022-04-15,"An Act To Make Certain Civil Court Records Accessible by the Public Only at the Courthouse","An Act To Make Certain Civil Court Records Accessible by the Public Only at the Courthouse",0,,2022-04-15,"PASSED TO BE ENACTED, in concurrence.",https://legiscan.com/ME/bill/LD913/2021,https://legislature.maine.gov/legis/bills/display_ps.asp?LD=913&snum=130
1473553,1806,LD914,6,Failed,2021-05-19,"An Act To Meet the State's Obligation To Pay 55 Percent of Education Costs","An Act To Meet the State's Obligation To Pay 55 Percent of Education Costs",0,,2021-05-19,"Pursuant to Joint Rule 310.3 Placed in Legislative Files (DEAD)",https://legiscan.com/ME/bill/LD914/2021,https://legislature.maine.gov/legis/bills/display_ps.asp?LD=914&snum=130
1473379,1806,LD915,6,Failed,2021-06-17,"An Act To Conform State Funding to the Federal Hyde Amendment Limiting Funding for Some Abortion Services","An Act To Conform State Funding to the Federal Hyde Amendment Limiting Funding for Some Abortion Services",0,,2021-06-17,"Placed in Legislative Files (DEAD)",https://legiscan.com/ME/bill/LD915/2021,https://legislature.maine.gov/legis/bills/display_ps.asp?LD=915&snum=130
1473455,1806,LD916,4,Passed,2021-06-16,"An Act To Protect Data Privacy and Security in Elections","An Act To Protect Data Privacy and Security in Elections",0,,2021-06-16,"PASSED TO BE ENACTED, in concurrence.",https://legiscan.com/ME/bill/LD916/2021,https://legislature.maine.gov/legis/bills/display_ps.asp?LD=916&snum=130
1473264,1806,LD917,6,Failed,2021-05-19,"An Act Regarding Electronic Monitoring of Pretrial and Post-conviction Defendants","An Act Regarding Electronic Monitoring of Pretrial and Post-conviction Defendants",0,,2021-05-19,"Pursuant to Joint Rule 310.3 Placed in Legislative Files (DEAD)",https://legiscan.com/ME/bill/LD917/2021,https://legislature.maine.gov/legis/bills/display_ps.asp?LD=917&snum=130
1473773,1806,LD918,6,Failed,2021-06-03,"An Act To Transition from a Fossil Fuel-based to an Electrical Energy Economy","An Act To Transition from a Fossil Fuel-based to an Electrical Energy Economy",0,,2021-06-03,"Pursuant to Joint Rule 310.3 Placed in Legislative Files (DEAD)",https://legiscan.com/ME/bill/LD918/2021,https://legislature.maine.gov/legis/bills/display_ps.asp?LD=918&snum=130
1473785,1806,LD919,6,Failed,2022-02-10,"An Act To Advance Maine's Economic Growth by Investing in Innovative, Next-generation Technology and Research","An Act To Advance Maine's Economic Growth by Investing in Innovative, Next-generation Technology and Research",0,,2022-02-10,"Pursuant to Joint Rule 310.3 Placed in Legislative Files (DEAD)",https://legiscan.com/ME/bill/LD919/2021,https://legislature.maine.gov/legis/bills/display_ps.asp?LD=919&snum=130
1473363,1806,LD920,5,Vetoed,2021-06-30,"An Act To Promote Oversight of and Competitive Parity among Video Service Providers","An Act To Promote Oversight of and Competitive Parity among Video Service Providers",0,,2021-06-30,"ORDERED SENT FORTHWITH.",https://legiscan.com/ME/bill/LD920/2021,https://legislature.maine.gov/legis/bills/display_ps.asp?LD=920&snum=130
1473494,1806,LD921,6,Failed,2021-06-03,"An Act To Eliminate Maine Clean Election Act Funding for Candidates in Gubernatorial Races","An Act To Eliminate Maine Clean Election Act Funding for Candidates in Gubernatorial Races",0,,2021-06-03,"Placed in Legislative Files (DEAD)",https://legiscan.com/ME/bill/LD921/2021,https://legislature.maine.gov/legis/bills/display_ps.asp?LD=921&snum=130
1473423,1806,LD922,6,Failed,2021-05-19,"An Act To Help Cancer Patients with Fertility Preservation","An Act To Help Cancer Patients with Fertility Preservation",0,,2021-05-19,"Pursuant to Joint Rule 310.3 Placed in Legislative Files (DEAD)",https://legiscan.com/ME/bill/LD922/2021,https://legislature.maine.gov/legis/bills/display_ps.asp?LD=922&snum=130
1473720,1806,LD923,6,Failed,2021-06-10,"An Act To Enact the Stop Guilt by Accusation Act","An Act To Enact the Stop Guilt by Accusation Act",0,,2021-06-10,"Placed in Legislative Files (DEAD)",https://legiscan.com/ME/bill/LD923/2021,https://legislature.maine.gov/legis/bills/display_ps.asp?LD=923&snum=130
1473735,1806,LD924,4,Passed,2021-07-02,"Resolve, To Establish a Task Force To Study the Coordination of Services and Expansion of Educational Programs and Vocational Opportunities for Young Adults with Intellectual or Developmental Disabilities or Acquired Brain Injury","Resolve, To Establish a Task Force To Study the Coordination of Services and Expansion of Educational Programs and Vocational Opportunities for Young Adults with Intellectual or Developmental Disabilities or Acquired Brain Injury",0,,2021-07-02,"FINALLY PASSED in concurrence",https://legiscan.com/ME/bill/LD924/2021,https://legislature.maine.gov/legis/bills/display_ps.asp?LD=924&snum=130
1473544,1806,LD925,6,Failed,2021-05-19,"Resolve, Directing the Department of Transportation To Develop a Plan To Redevelop Exit 5 of Interstate 295 in Portland","Resolve, Directing the Department of Transportation To Develop a Plan To Redevelop Exit 5 of Interstate 295 in Portland",0,,2021-05-19,"Pursuant to Joint Rule 310.3 Placed in Legislative Files (DEAD)",https://legiscan.com/ME/bill/LD925/2021,https://legislature.maine.gov/legis/bills/display_ps.asp?LD=925&snum=130
1473539,1806,LD926,6,Failed,2021-07-19,"An Act To Ban Biological Males from Participating in Women's Sports","An Act To Ban Biological Males from Participating in Women's Sports",0,,2021-07-19,"IN POSSESSION OF THE SENATE WHEN THE SENATE ADJOURNED SINE DIE AND PLACED IN THE LEGISLATIVE FILES (DEAD)",https://legiscan.com/ME/bill/LD926/2021,https://legislature.maine.gov/legis/bills/display_ps.asp?LD=926&snum=130
1473337,1806,LD927,6,Failed,2021-06-10,"An Act To Increase the Availability of Health Care Services by Eliminating the Certificate of Need for All Health Care Services","An Act To Increase the Availability of Health Care Services by Eliminating the Certificate of Need for All Health Care Services",0,,2021-06-10,"Placed in Legislative Files (DEAD)",https://legiscan.com/ME/bill/LD927/2021,https://legislature.maine.gov/legis/bills/display_ps.asp?LD=927&snum=130
1473467,1806,LD928,6,Failed,2021-05-19,"An Act To Require Adequate Training for Police Officers Who Use Speed Measurement Devices","An Act To Require Adequate Training for Police Officers Who Use Speed Measurement Devices",0,,2021-05-19,"Pursuant to Joint Rule 310.3 Placed in Legislative Files (DEAD)",https://legiscan.com/ME/bill/LD928/2021,https://legislature.maine.gov/legis/bills/display_ps.asp?LD=928&snum=130
1473260,1806,LD929,6,Failed,2021-06-09,"An Act To Address Funding for Maine Clean Elections","An Act To Address Funding for Maine Clean Elections",0,,2021-06-09,"Placed in Legislative Files (DEAD)",https://legiscan.com/ME/bill/LD929/2021,https://legislature.maine.gov/legis/bills/display_ps.asp?LD=929&snum=130
1473440,1806,LD930,6,Failed,2021-06-08,"An Act To Revise Reporting Requirements for Maine Clean Election Act Expenditures","An Act To Revise Reporting Requirements for Maine Clean Election Act Expenditures",0,,2021-06-08,"Placed in Legislative Files (DEAD)",https://legiscan.com/ME/bill/LD930/2021,https://legislature.maine.gov/legis/bills/display_ps.asp?LD=930&snum=130
1473340,1806,LD931,6,Failed,2021-06-02,"An Act To Increase Hospital Bed Capacity by Eliminating the Certificate of Need for Outside Hospital Beds","An Act To Increase Hospital Bed Capacity by Eliminating the Certificate of Need for Outside Hospital Beds",0,,2021-06-02,"Placed in Legislative Files (DEAD)",https://legiscan.com/ME/bill/LD931/2021,https://legislature.maine.gov/legis/bills/display_ps.asp?LD=931&snum=130
1473372,1806,LD932,6,Failed,2021-06-02,"An Act To Increase Hospital Capacity by Eliminating the Certificate of Need for Hospital Beds","An Act To Increase Hospital Capacity by Eliminating the Certificate of Need for Hospital Beds",0,,2021-06-02,"Placed in Legislative Files (DEAD)",https://legiscan.com/ME/bill/LD932/2021,https://legislature.maine.gov/legis/bills/display_ps.asp?LD=932&snum=130
1473747,1806,LD933,6,Failed,2021-06-03,"An Act To Facilitate the Expansion of Broadband to Unserved Areas of the State","An Act To Facilitate the Expansion of Broadband to Unserved Areas of the State",0,,2021-06-03,"Pursuant to Joint Rule 310.3 Placed in Legislative Files (DEAD)",https://legiscan.com/ME/bill/LD933/2021,https://legislature.maine.gov/legis/bills/display_ps.asp?LD=933&snum=130
1473419,1806,LD934,6,Failed,2021-04-28,"An Act To Create a Family and Juvenile Mediation Program within the Department of Health and Human Services","An Act To Create a Family and Juvenile Mediation Program within the Department of Health and Human Services",0,,2021-04-28,"Pursuant to Joint Rule 310.3 Placed in Legislative Files (DEAD)",https://legiscan.com/ME/bill/LD934/2021,https://legislature.maine.gov/legis/bills/display_ps.asp?LD=934&snum=130
1473805,1806,LD935,6,Failed,2021-06-02,"An Act To Increase the Ability of Health Care Facilities To Respond to Health Needs by Eliminating the Certificate of Need for Health Care Facilities","An Act To Increase the Ability of Health Care Facilities To Respond to Health Needs by Eliminating the Certificate of Need for Health Care Facilities",0,,2021-06-02,"Placed in Legislative Files (DEAD)",https://legiscan.com/ME/bill/LD935/2021,https://legislature.maine.gov/legis/bills/display_ps.asp?LD=935&snum=130
1473410,1806,LD936,4,Passed,2021-06-17,"An Act To Amend State Laws Relating to Net Energy Billing and the Procurement of Distributed Generation","An Act To Amend State Laws Relating to Net Energy Billing and the Procurement of Distributed Generation",0,,2021-06-17,"PASSED TO BE ENACTED, in concurrence.",https://legiscan.com/ME/bill/LD936/2021,https://legislature.maine.gov/legis/bills/display_ps.asp?LD=936&snum=130
1473576,1806,LD937,4,Passed,2021-06-03,"Resolve, To Direct the Department of Agriculture, Conservation and Forestry and the Department of Inland Fisheries and Wildlife To Jointly Develop Recommendations Regarding Carbon Storage Programs and Policies","Resolve, To Direct the Department of Agriculture, Conservation and Forestry and the Department of Inland Fisheries and Wildlife To Jointly Develop Recommendations Regarding Carbon Storage Programs and Policies",0,,2021-06-03,"FINALLY PASSED, in concurrence.",https://legiscan.com/ME/bill/LD937/2021,https://legislature.maine.gov/legis/bills/display_ps.asp?LD=937&snum=130
1473568,1806,LD938,6,Failed,2021-06-10,"An Act To Ensure Maine Workers' Right To Request a Schedule Change at Their Places of Employment","An Act To Ensure Maine Workers' Right To Request a Schedule Change at Their Places of Employment",0,,2021-06-10,"Placed in Legislative Files (DEAD)",https://legiscan.com/ME/bill/LD938/2021,https://legislature.maine.gov/legis/bills/display_ps.asp?LD=938&snum=130
1473628,1806,LD939,4,Passed,2021-06-14,"An Act To Support Maine's Medical Marijuana Program and Ensure Patient Access","An Act To Support Maine's Medical Marijuana Program and Ensure Patient Access",0,,2021-06-14,"PASSED TO BE ENACTED, in concurrence.",https://legiscan.com/ME/bill/LD939/2021,https://legislature.maine.gov/legis/bills/display_ps.asp?LD=939&snum=130
1473489,1806,LD940,4,Passed,2021-07-02,"An Act To Establish Appliance Energy and Water Standards","An Act To Establish Appliance Energy and Water Standards",0,,2021-07-02,"PASSED TO BE ENACTED in concurrence",https://legiscan.com/ME/bill/LD940/2021,https://legislature.maine.gov/legis/bills/display_ps.asp?LD=940&snum=130
1473431,1806,LD941,6,Failed,2021-06-03,"An Act To Protect the Privacy of Absentee Voters","An Act To Protect the Privacy of Absentee Voters",0,,2021-06-03,"Placed in Legislative Files (DEAD)",https://legiscan.com/ME/bill/LD941/2021,https://legislature.maine.gov/legis/bills/display_ps.asp?LD=941&snum=130
1473798,1806,LD942,6,Failed,2021-06-08,"An Act To Waive Professional and Occupational Licensing Fees for Calendar Year 2020","An Act To Waive Professional and Occupational Licensing Fees for Calendar Year 2020",0,,2021-06-08,"Placed in Legislative Files (DEAD)",https://legiscan.com/ME/bill/LD942/2021,https://legislature.maine.gov/legis/bills/display_ps.asp?LD=942&snum=130
1473710,1806,LD943,4,Passed,2021-06-03,"An Act To Improve Turkey Tagging","An Act To Improve Turkey Tagging",0,,2021-06-03,"PASSED TO BE ENACTED, in concurrence.",https://legiscan.com/ME/bill/LD943/2021,https://legislature.maine.gov/legis/bills/display_ps.asp?LD=943&snum=130
1473223,1806,LD944,6,Failed,2021-05-19,"An Act To Simplify Dual Registration of Snowmobiles and All-terrain Vehicles","An Act To Simplify Dual Registration of Snowmobiles and All-terrain Vehicles",0,,2021-05-19,"Pursuant to Joint Rule 310.3 Placed in Legislative Files (DEAD)",https://legiscan.com/ME/bill/LD944/2021,https://legislature.maine.gov/legis/bills/display_ps.asp?LD=944&snum=130
1473461,1806,LD945,4,Passed,2021-06-16,"An Act Regarding Notice by Health Insurance Carriers of Policy Changes","An Act Regarding Notice by Health Insurance Carriers of Policy Changes",0,,2021-06-16,"PASSED TO BE ENACTED, in concurrence.",https://legiscan.com/ME/bill/LD945/2021,https://legislature.maine.gov/legis/bills/display_ps.asp?LD=945&snum=130
