bill_id,session_id,bill_number,status,status_desc,status_date,title,description,committee_id,committee,last_action_date,last_action,url,state_link
1454109,1806,LD489,6,Failed,2022-05-09,"RESOLUTION, Proposing an Amendment to the Constitution of Maine To Establish a Right to a Healthy Environment","RESOLUTION, Proposing an Amendment to the Constitution of Maine To Establish a Right to a Healthy Environment",0,,2022-05-09,"In possession of the Senate when the Legislature adjourned Sine Die and was placed in the Legislative Files. (DEAD)",https://legiscan.com/ME/bill/LD489/2021,https://legislature.maine.gov/legis/bills/display_ps.asp?LD=489&snum=130
1453768,1806,LD490,6,Failed,2021-03-30,"An Act To Eliminate Certain Motor Vehicle Inspections in the State","An Act To Eliminate Certain Motor Vehicle Inspections in the State",0,,2021-03-30,"Pursuant to Joint Rule 310.3 Placed in Legislative Files (DEAD)",https://legiscan.com/ME/bill/LD490/2021,https://legislature.maine.gov/legis/bills/display_ps.asp?LD=490&snum=130
1453854,1806,LD491,4,Passed,2021-06-08,"An Act To Give Special Weight to Discriminatory Motive in Sentencing for False Public Alarm or Report","An Act To Give Special Weight to Discriminatory Motive in Sentencing for False Public Alarm or Report",0,,2021-06-08,"PASSED TO BE ENACTED, in concurrence.",https://legiscan.com/ME/bill/LD491/2021,https://legislature.maine.gov/legis/bills/display_ps.asp?LD=491&snum=130
1454261,1806,LD492,4,Passed,2021-07-02,"An Act To Create a Regional Grant Program To Help Rural Businesses Find Qualified Staff","An Act To Create a Regional Grant Program To Help Rural Businesses Find Qualified Staff",0,,2021-07-02,"PASSED TO BE ENACTED, in concurrence.",https://legiscan.com/ME/bill/LD492/2021,https://legislature.maine.gov/legis/bills/display_ps.asp?LD=492&snum=130
1453840,1806,LD493,6,Failed,2022-05-09,"An Act To Increase Capacity for Slaughtering and Meat Processing in Maine","An Act To Increase Capacity for Slaughtering and Meat Processing in Maine",0,,2022-05-09,"In possession of the Senate when the Legislature adjourned Sine Die and was placed in the Legislative Files. (DEAD)",https://legiscan.com/ME/bill/LD493/2021,https://legislature.maine.gov/legis/bills/display_ps.asp?LD=493&snum=130
1459484,1806,LD521,4,Passed,2021-06-08,"An Act To Modify the Rule-making Process for Establishing County and Municipal Jail Standards","An Act To Modify the Rule-making Process for Establishing County and Municipal Jail Standards",0,,2021-06-08,"PASSED TO BE ENACTED, in concurrence.",https://legiscan.com/ME/bill/LD521/2021,https://legislature.maine.gov/legis/bills/display_ps.asp?LD=521&snum=130
1459470,1806,LD522,4,Passed,2021-06-14,"An Act To Protect Consumers against Predatory Lending Practices","An Act To Protect Consumers against Predatory Lending Practices",0,,2021-06-14,"PASSED TO BE ENACTED, in concurrence.",https://legiscan.com/ME/bill/LD522/2021,https://legislature.maine.gov/legis/bills/display_ps.asp?LD=522&snum=130
1459520,1806,LD523,4,Passed,2021-05-19,"An Act Regarding Prior Authorizations for Prescription Drugs","An Act Regarding Prior Authorizations for Prescription Drugs",0,,2021-05-19,"PASSED TO BE ENACTED, in concurrence.",https://legiscan.com/ME/bill/LD523/2021,https://legislature.maine.gov/legis/bills/display_ps.asp?LD=523&snum=130
1459462,1806,LD524,4,Passed,2021-06-09,"Resolve, Directing the Board of Pesticides Control To Research Workable Methods To Collect Pesticide Sales and Use Records for the Purpose of Providing Information to the Public","Resolve, Directing the Board of Pesticides Control To Research Workable Methods To Collect Pesticide Sales and Use Records for the Purpose of Providing Information to the Public",0,,2021-06-09,"FINALLY PASSED, in concurrence.",https://legiscan.com/ME/bill/LD524/2021,https://legislature.maine.gov/legis/bills/display_ps.asp?LD=524&snum=130
1459436,1806,LD525,6,Failed,2021-05-19,"An Act To Allow Medical and Adult Use Marijuana Stores To Share a Common Space","An Act To Allow Medical and Adult Use Marijuana Stores To Share a Common Space",0,,2021-05-19,"Pursuant to Joint Rule 310.3 Placed in Legislative Files (DEAD)",https://legiscan.com/ME/bill/LD525/2021,https://legislature.maine.gov/legis/bills/display_ps.asp?LD=525&snum=130
1459396,1806,LD526,6,Failed,2021-05-19,"An Act To Require an Affidavit for Every Independent Expenditure Influencing an Election and To Penalize the Use of Mistruths","An Act To Require an Affidavit for Every Independent Expenditure Influencing an Election and To Penalize the Use of Mistruths",0,,2021-05-19,"Pursuant to Joint Rule 310.3 Placed in Legislative Files (DEAD)",https://legiscan.com/ME/bill/LD526/2021,https://legislature.maine.gov/legis/bills/display_ps.asp?LD=526&snum=130
1459373,1806,LD527,6,Failed,2022-05-09,"An Act To Exempt MaineCare Appendix C Private Nonmedical Institutions from the Service Provider Tax","An Act To Exempt MaineCare Appendix C Private Nonmedical Institutions from the Service Provider Tax",0,,2022-05-09,"In possession of the Senate when the Legislature adjourned Sine Die and was placed in the Legislative Files. (DEAD)",https://legiscan.com/ME/bill/LD527/2021,https://legislature.maine.gov/legis/bills/display_ps.asp?LD=527&snum=130
1459534,1806,LD528,4,Passed,2021-06-17,"An Act To Advance Energy Storage in Maine","An Act To Advance Energy Storage in Maine",0,,2021-06-17,"PASSED TO BE ENACTED, in concurrence.",https://legiscan.com/ME/bill/LD528/2021,https://legislature.maine.gov/legis/bills/display_ps.asp?LD=528&snum=130
1459508,1806,LD529,4,Passed,2021-05-19,"Resolve, To Direct the Department of Health and Human Services To Review the Needs of Persons with Low-incidence Health Conditions","Resolve, To Direct the Department of Health and Human Services To Review the Needs of Persons with Low-incidence Health Conditions",0,,2021-05-19,"FINALLY PASSED, in concurrence.",https://legiscan.com/ME/bill/LD529/2021,https://legislature.maine.gov/legis/bills/display_ps.asp?LD=529&snum=130
1459547,1806,LD530,6,Failed,2021-05-19,"An Act To Consolidate Patient Bills by Directing Health Insurers To Collect Copayments and Deductibles","An Act To Consolidate Patient Bills by Directing Health Insurers To Collect Copayments and Deductibles",0,,2021-05-19,"Pursuant to Joint Rule 310.3 Placed in Legislative Files (DEAD)",https://legiscan.com/ME/bill/LD530/2021,https://legislature.maine.gov/legis/bills/display_ps.asp?LD=530&snum=130
1459385,1806,LD531,6,Failed,2021-03-30,"An Act To Help More Students Attain a College Credential by Strengthening the Maine State Grant Program","An Act To Help More Students Attain a College Credential by Strengthening the Maine State Grant Program",0,,2021-03-30,"Pursuant to Joint Rule 310.3 Placed in Legislative Files (DEAD)",https://legiscan.com/ME/bill/LD531/2021,https://legislature.maine.gov/legis/bills/display_ps.asp?LD=531&snum=130
1459447,1806,LD532,6,Failed,2021-06-02,"An Act To Lower Income Taxes for Middle-income Families in Maine","An Act To Lower Income Taxes for Middle-income Families in Maine",0,,2021-06-02,"Pursuant to Joint Rule 310.3 Placed in Legislative Files (DEAD)",https://legiscan.com/ME/bill/LD532/2021,https://legislature.maine.gov/legis/bills/display_ps.asp?LD=532&snum=130
1459327,1806,LD533,4,Passed,2022-04-25,"An Act To Expand the Statewide Voluntary Early Childhood Consultation Program","An Act To Expand the Statewide Voluntary Early Childhood Consultation Program",0,,2022-04-25,"PASSED TO BE ENACTED, in concurrence.",https://legiscan.com/ME/bill/LD533/2021,https://legislature.maine.gov/legis/bills/display_ps.asp?LD=533&snum=130
1459315,1806,LD534,6,Failed,2021-06-07,"An Act To Allow Tax Abatements for Catastrophic Loss","An Act To Allow Tax Abatements for Catastrophic Loss",0,,2021-06-07,"Pursuant to Joint Rule 310.3 Placed in Legislative Files (DEAD)",https://legiscan.com/ME/bill/LD534/2021,https://legislature.maine.gov/legis/bills/display_ps.asp?LD=534&snum=130
1459411,1806,LD535,4,Passed,2021-06-08,"An Act To Provide for the Well-being of Companion Animals upon the Dissolution of Marriages","An Act To Provide for the Well-being of Companion Animals upon the Dissolution of Marriages",0,,2021-06-08,"PASSED TO BE ENACTED, in concurrence.",https://legiscan.com/ME/bill/LD535/2021,https://legislature.maine.gov/legis/bills/display_ps.asp?LD=535&snum=130
1459495,1806,LD536,4,Passed,2021-06-17,"An Act To Amend the Maine Criminal Code","An Act To Amend the Maine Criminal Code",0,,2021-06-17,"PASSED TO BE ENACTED, in concurrence.",https://legiscan.com/ME/bill/LD536/2021,https://legislature.maine.gov/legis/bills/display_ps.asp?LD=536&snum=130
1459337,1806,LD537,4,Passed,2021-06-09,"An Act To Dedicate Sections of Maine's State Highway System to Fallen State Troopers","An Act To Dedicate Sections of Maine's State Highway System to Fallen State Troopers",0,,2021-06-09,"PASSED TO BE ENACTED, in concurrence.",https://legiscan.com/ME/bill/LD537/2021,https://legislature.maine.gov/legis/bills/display_ps.asp?LD=537&snum=130
1459423,1806,LD538,6,Failed,2022-05-09,"An Act To Exempt Trailers Sold to Out-of-state Entities from Sales and Use Tax","An Act To Exempt Trailers Sold to Out-of-state Entities from Sales and Use Tax",0,,2022-05-09,"In possession of the Senate when the Legislature adjourned Sine Die and was placed in the Legislative Files. (DEAD)",https://legiscan.com/ME/bill/LD538/2021,https://legislature.maine.gov/legis/bills/display_ps.asp?LD=538&snum=130
1459350,1806,LD539,6,Failed,2021-06-02,"An Act To Require Law Enforcement Agencies To Do a Thorough Background Check of Applicant Officers and To Require the Release of Records, Including Sealed Records, to the Requesting Agency","An Act To Require Law Enforcement Agencies To Do a Thorough Background Check of Applicant Officers and To Require the Release of Records, Including Sealed Records, to the Requesting Agency",0,,2021-06-02,"Pursuant to Joint Rule 310.3 Placed in Legislative Files (DEAD)",https://legiscan.com/ME/bill/LD539/2021,https://legislature.maine.gov/legis/bills/display_ps.asp?LD=539&snum=130
1460112,1806,LD575,4,Passed,2022-04-25,"An Act To Establish a Conditional Presumption of Compensability for Certain Employees in Cases of Impairment from Hypertension or Heart Disease","An Act To Establish a Conditional Presumption of Compensability for Certain Employees in Cases of Impairment from Hypertension or Heart Disease",0,,2022-04-25,"PASSED TO BE ENACTED, in concurrence.",https://legiscan.com/ME/bill/LD575/2021,https://legislature.maine.gov/legis/bills/display_ps.asp?LD=575&snum=130
1460196,1806,LD576,6,Failed,2022-05-09,"An Act To Increase Property Tax Relief for Veterans","An Act To Increase Property Tax Relief for Veterans",0,,2022-05-09,"In possession of the Senate when the Legislature adjourned Sine Die and was placed in the Legislative Files. (DEAD)",https://legiscan.com/ME/bill/LD576/2021,https://legislature.maine.gov/legis/bills/display_ps.asp?LD=576&snum=130
1465157,1806,LD594,4,Passed,2021-05-19,"Resolve, Directing the Department of Labor To Submit to the United States Secretary of Labor a Plan for a Self-employment Assistance Program","Resolve, Directing the Department of Labor To Submit to the United States Secretary of Labor a Plan for a Self-employment Assistance Program",0,,2021-05-19,"FINALLY PASSED, in concurrence.",https://legiscan.com/ME/bill/LD594/2021,https://legislature.maine.gov/legis/bills/display_ps.asp?LD=594&snum=130
1465241,1806,LD595,4,Passed,2021-07-02,"Resolve, To Ensure That Access to Oral and Facial Ambulatory Surgical Centers in Maine Remains Viable","Resolve, To Ensure That Access to Oral and Facial Ambulatory Surgical Centers in Maine Remains Viable",0,,2021-07-02,"FINALLY PASSED - Emergency - 2/3 Elected Required, in concurrence.",https://legiscan.com/ME/bill/LD595/2021,https://legislature.maine.gov/legis/bills/display_ps.asp?LD=595&snum=130
1465023,1806,LD596,4,Passed,2021-06-07,"An Act To Improve the Law Regarding Abandoned Roads","An Act To Improve the Law Regarding Abandoned Roads",0,,2021-06-07,"PASSED TO BE ENACTED, in concurrence.",https://legiscan.com/ME/bill/LD596/2021,https://legislature.maine.gov/legis/bills/display_ps.asp?LD=596&snum=130
1464913,1806,LD597,4,Passed,2021-06-09,"An Act To Establish the Thermal Energy Investment Program","An Act To Establish the Thermal Energy Investment Program",0,,2021-06-09,"PASSED TO BE ENACTED, in concurrence.",https://legiscan.com/ME/bill/LD597/2021,https://legislature.maine.gov/legis/bills/display_ps.asp?LD=597&snum=130
1465181,1806,LD598,4,Passed,2022-04-15,"An Act To Prohibit Discrimination in Employment and School Based on Hair Texture or Hairstyle","An Act To Prohibit Discrimination in Employment and School Based on Hair Texture or Hairstyle",0,,2022-04-15,"Roll Call Ordered Roll Call Number 757 Yeas 26 - Nays 6 - Excused 2 - Absent 0",https://legiscan.com/ME/bill/LD598/2021,https://legislature.maine.gov/legis/bills/display_ps.asp?LD=598&snum=130
1464928,1806,LD599,6,Failed,2021-04-28,"An Act To Require Coverage for Certain Ultrasound Exams","An Act To Require Coverage for Certain Ultrasound Exams",0,,2021-04-28,"Pursuant to Joint Rule 310.3 Placed in Legislative Files (DEAD)",https://legiscan.com/ME/bill/LD599/2021,https://legislature.maine.gov/legis/bills/display_ps.asp?LD=599&snum=130
1464950,1806,LD600,4,Passed,2021-05-19,"An Act To Require Insurance Coverage for Certified Midwife Services","An Act To Require Insurance Coverage for Certified Midwife Services",0,,2021-05-19,"PASSED TO BE ENACTED, in concurrence.",https://legiscan.com/ME/bill/LD600/2021,https://legislature.maine.gov/legis/bills/display_ps.asp?LD=600&snum=130
1465260,1806,LD601,6,Failed,2021-04-28,"An Act Regarding Indices of Vital Records","An Act Regarding Indices of Vital Records",0,,2021-04-28,"Placed in the Legislative Files. (DEAD)",https://legiscan.com/ME/bill/LD601/2021,https://legislature.maine.gov/legis/bills/display_ps.asp?LD=601&snum=130
1465115,1806,LD602,6,Failed,2021-06-07,"An Act To Prevent Pollution from Single-use Plastic Straws, Splash Sticks and Beverage Lid Plugs","An Act To Prevent Pollution from Single-use Plastic Straws, Splash Sticks and Beverage Lid Plugs",0,,2021-06-07,"Placed in the Legislative Files. (DEAD)",https://legiscan.com/ME/bill/LD602/2021,https://legislature.maine.gov/legis/bills/display_ps.asp?LD=602&snum=130
1464940,1806,LD603,4,Passed,2021-06-07,"An Act Regarding the Practice of Pharmacy","An Act Regarding the Practice of Pharmacy",0,,2021-06-07,"PASSED TO BE ENACTED, in concurrence.",https://legiscan.com/ME/bill/LD603/2021,https://legislature.maine.gov/legis/bills/display_ps.asp?LD=603&snum=130
1469785,1806,LD630,4,Passed,2021-06-03,"An Act To Prohibit Shelf-stable Products from Being Sold as Cider","An Act To Prohibit Shelf-stable Products from Being Sold as Cider",0,,2021-06-03,"PASSED TO BE ENACTED, in concurrence.",https://legiscan.com/ME/bill/LD630/2021,https://legislature.maine.gov/legis/bills/display_ps.asp?LD=630&snum=130
1469444,1806,LD631,4,Passed,2021-06-02,"An Act To Provide Funding for Maine's Health Insurance Consumer Assistance Program","An Act To Provide Funding for Maine's Health Insurance Consumer Assistance Program",0,,2021-06-02,"PASSED TO BE ENACTED, in concurrence.",https://legiscan.com/ME/bill/LD631/2021,https://legislature.maine.gov/legis/bills/display_ps.asp?LD=631&snum=130
1469835,1806,LD632,6,Failed,2022-02-10,"An Act To Facilitate the Conversion of Children's Private Nonmedical Institutions to Qualified Residential Treatment Programs as Required by Federal Law","An Act To Facilitate the Conversion of Children's Private Nonmedical Institutions to Qualified Residential Treatment Programs as Required by Federal Law",0,,2022-02-10,"Pursuant to Joint Rule 310.3 Placed in Legislative Files (DEAD)",https://legiscan.com/ME/bill/LD632/2021,https://legislature.maine.gov/legis/bills/display_ps.asp?LD=632&snum=130
1469622,1806,LD633,4,Passed,2021-06-14,"Resolve, Directing the Department of Education To Review Diversity, Equity and Inclusion Training and Other Professional Development for School Staff","Resolve, Directing the Department of Education To Review Diversity, Equity and Inclusion Training and Other Professional Development for School Staff",0,,2021-06-14,"FINALLY PASSED, in concurrence.",https://legiscan.com/ME/bill/LD633/2021,https://legislature.maine.gov/legis/bills/display_ps.asp?LD=633&snum=130
1469492,1806,LD634,4,Passed,2022-04-20,"An Act To Reduce Volatility in the Net Energy Billing Program and To Define ""Competitive Electricity Provider""","An Act To Reduce Volatility in the Net Energy Billing Program and To Define ""Competitive Electricity Provider""",0,,2022-04-20,"PASSED TO BE ENACTED, in concurrence.",https://legiscan.com/ME/bill/LD634/2021,https://legislature.maine.gov/legis/bills/display_ps.asp?LD=634&snum=130
1469773,1806,LD635,4,Passed,2021-06-03,"An Act To Repeal the Requirement To Obtain a Permit before Hunting with a Noise Suppression Device","An Act To Repeal the Requirement To Obtain a Permit before Hunting with a Noise Suppression Device",0,,2021-06-03,"PASSED TO BE ENACTED, in concurrence.",https://legiscan.com/ME/bill/LD635/2021,https://legislature.maine.gov/legis/bills/display_ps.asp?LD=635&snum=130
1469515,1806,LD636,4,Passed,2021-07-02,"An Act To Encourage the Purchase of Local Foods for Public Schools","An Act To Encourage the Purchase of Local Foods for Public Schools",0,,2021-07-02,"PASSED TO BE ENACTED - Emergency -2/3 Elected Required in concurrence",https://legiscan.com/ME/bill/LD636/2021,https://legislature.maine.gov/legis/bills/display_ps.asp?LD=636&snum=130
1469805,1806,LD646,6,Failed,2021-06-02,"An Act To Improve the Administration of Elections by Ensuring an Adequate Number of Poll Workers","An Act To Improve the Administration of Elections by Ensuring an Adequate Number of Poll Workers",0,,2021-06-02,"Pursuant to Joint Rule 310.3 Placed in Legislative Files (DEAD)",https://legiscan.com/ME/bill/LD646/2021,https://legislature.maine.gov/legis/bills/display_ps.asp?LD=646&snum=130
1469467,1806,LD647,4,Passed,2022-04-25,"An Act To Expand Eligibility for the Veterans' Property Tax Exemption","An Act To Expand Eligibility for the Veterans' Property Tax Exemption",0,,2022-04-25,"PASSED TO BE ENACTED, in concurrence.",https://legiscan.com/ME/bill/LD647/2021,https://legislature.maine.gov/legis/bills/display_ps.asp?LD=647&snum=130
1469541,1806,LD648,4,Passed,2021-06-07,"An Act To Improve the Lives of Maine Workers by Supporting Apprenticeships That Lead to Good-paying Jobs","An Act To Improve the Lives of Maine Workers by Supporting Apprenticeships That Lead to Good-paying Jobs",0,,2021-06-07,"PASSED TO BE ENACTED, in concurrence.",https://legiscan.com/ME/bill/LD648/2021,https://legislature.maine.gov/legis/bills/display_ps.asp?LD=648&snum=130
1469844,1806,LD649,6,Failed,2021-06-02,"An Act To Expand and Promote Telehealth Services","An Act To Expand and Promote Telehealth Services",0,,2021-06-02,"Pursuant to Joint Rule 310.3 Placed in Legislative Files (DEAD)",https://legiscan.com/ME/bill/LD649/2021,https://legislature.maine.gov/legis/bills/display_ps.asp?LD=649&snum=130
1469664,1806,LD671,4,Passed,2021-06-07,"An Act To Allow the Sale of Raffle Tickets Online","An Act To Allow the Sale of Raffle Tickets Online",0,,2021-06-07,"PASSED TO BE ENACTED - Emergency - 2/3 Elected Required, in concurrence.",https://legiscan.com/ME/bill/LD671/2021,https://legislature.maine.gov/legis/bills/display_ps.asp?LD=671&snum=130
1471064,1806,LD672,4,Passed,2021-06-09,"Resolve, To Direct the Department of Transportation To Use a Rail Corridor Use Advisory Council in Reviewing the Mountain Division Line for Potential Nonrail Uses","Resolve, To Direct the Department of Transportation To Use a Rail Corridor Use Advisory Council in Reviewing the Mountain Division Line for Potential Nonrail Uses",0,,2021-06-09,"FINALLY PASSED - Emergency - 2/3 Elected Required, in concurrence.",https://legiscan.com/ME/bill/LD672/2021,https://legislature.maine.gov/legis/bills/display_ps.asp?LD=672&snum=130
1470915,1806,LD673,4,Passed,2021-06-17,"An Act To Create the Insulin Safety Net Program","An Act To Create the Insulin Safety Net Program",0,,2021-06-17,"PASSED TO BE ENACTED, in concurrence.",https://legiscan.com/ME/bill/LD673/2021,https://legislature.maine.gov/legis/bills/display_ps.asp?LD=673&snum=130
1471114,1806,LD674,6,Failed,2022-05-09,"An Act To Support Early Intervention and Treatment of Psychotic Disorders","An Act To Support Early Intervention and Treatment of Psychotic Disorders",0,,2022-05-09,"In possession of the Senate when the Legislature adjourned Sine Die and was placed in the Legislative Files. (DEAD)",https://legiscan.com/ME/bill/LD674/2021,https://legislature.maine.gov/legis/bills/display_ps.asp?LD=674&snum=130
1470904,1806,LD675,5,Vetoed,2021-07-19,"An Act To Protect Maine Consumers from Unsupported Price Increases on Prescription Medicines","An Act To Protect Maine Consumers from Unsupported Price Increases on Prescription Medicines",0,,2021-07-19,"Placed in Legislative Files (DEAD)",https://legiscan.com/ME/bill/LD675/2021,https://legislature.maine.gov/legis/bills/display_ps.asp?LD=675&snum=130
1470976,1806,LD676,6,Failed,2022-03-09,"An Act To Reclassify Part of the Androscoggin River to Class B","An Act To Reclassify Part of the Androscoggin River to Class B",0,,2022-03-09,"Pursuant to Joint Rule 310.3 Placed in Legislative Files (DEAD)",https://legiscan.com/ME/bill/LD676/2021,https://legislature.maine.gov/legis/bills/display_ps.asp?LD=676&snum=130
1470899,1806,LD677,5,Vetoed,2021-07-19,"An Act To Improve Public Sector Labor Relations by Amending the Laws Governing Arbitration under Certain Public Employees Labor Relations Laws","An Act To Improve Public Sector Labor Relations by Amending the Laws Governing Arbitration under Certain Public Employees Labor Relations Laws",0,,2021-07-19,"Placed in Legislative Files (DEAD)",https://legiscan.com/ME/bill/LD677/2021,https://legislature.maine.gov/legis/bills/display_ps.asp?LD=677&snum=130
1471123,1806,LD678,6,Failed,2021-04-28,"An Act Regarding Timelines for Permitting by the Department of Environmental Protection","An Act Regarding Timelines for Permitting by the Department of Environmental Protection",0,,2021-04-28,"Pursuant to Joint Rule 310.3 Placed in Legislative Files (DEAD)",https://legiscan.com/ME/bill/LD678/2021,https://legislature.maine.gov/legis/bills/display_ps.asp?LD=678&snum=130
1470939,1806,LD679,4,Passed,2022-04-25,"An Act To Establish a Statewide Electronic Warrant System","An Act To Establish a Statewide Electronic Warrant System",0,,2022-04-25,"Subsequently PASSED TO BE ENACTED in concurrence",https://legiscan.com/ME/bill/LD679/2021,https://legislature.maine.gov/legis/bills/display_ps.asp?LD=679&snum=130
1470808,1806,LD680,4,Passed,2022-04-25,"Resolve, To Reestablish the Task Force To Study the Creation of a Comprehensive Career and Technical Education System","Resolve, To Reestablish the Task Force To Study the Creation of a Comprehensive Career and Technical Education System",0,,2022-04-25,"Subsequently FINALLY PASSED - Emergency 2/3 Elected Required in concurrence",https://legiscan.com/ME/bill/LD680/2021,https://legislature.maine.gov/legis/bills/display_ps.asp?LD=680&snum=130
1470858,1806,LD681,6,Failed,2021-07-19,"Resolve, To Establish a Task Force To Study Safe and Stable Housing in Lodging Facilities","Resolve, To Establish a Task Force To Study Safe and Stable Housing in Lodging Facilities",0,,2021-07-19,"ADJOURNED SINE DIE and PLACED IN THE LEGISLATIVE FILES (DEAD).",https://legiscan.com/ME/bill/LD681/2021,https://legislature.maine.gov/legis/bills/display_ps.asp?LD=681&snum=130
1471086,1806,LD682,4,Passed,2022-04-13,"Resolve, To Monitor Northern and Rural Energy","Resolve, To Monitor Northern and Rural Energy",0,,2022-04-13,"FINALLY PASSED, in concurrence.",https://legiscan.com/ME/bill/LD682/2021,https://legislature.maine.gov/legis/bills/display_ps.asp?LD=682&snum=130
1470803,1806,LD683,4,Passed,2021-06-16,"An Act To Allow Maine Nonprofit Corporations To Hold Meetings Electronically","An Act To Allow Maine Nonprofit Corporations To Hold Meetings Electronically",0,,2021-06-16,"PASSED TO BE ENACTED, in concurrence.",https://legiscan.com/ME/bill/LD683/2021,https://legislature.maine.gov/legis/bills/display_ps.asp?LD=683&snum=130
1470996,1806,LD684,4,Passed,2022-04-25,"Resolve, To Amend MaineCare Reimbursement Provisions Governing Supplemental Payments to Nursing Facilities with High MaineCare Use","Resolve, To Amend MaineCare Reimbursement Provisions Governing Supplemental Payments to Nursing Facilities with High MaineCare Use",0,,2022-04-25,"Subsequently FINALLY PASSED - Emergency 2/3 Elected Required in concurrence",https://legiscan.com/ME/bill/LD684/2021,https://legislature.maine.gov/legis/bills/display_ps.asp?LD=684&snum=130
1470950,1806,LD685,6,Failed,2021-04-28,"An Act To Legalize Online Raffles for Nonprofit Organizations","An Act To Legalize Online Raffles for Nonprofit Organizations",0,,2021-04-28,"Pursuant to Joint Rule 310.3 Placed in Legislative Files (DEAD)",https://legiscan.com/ME/bill/LD685/2021,https://legislature.maine.gov/legis/bills/display_ps.asp?LD=685&snum=130
1470852,1806,LD686,4,Passed,2021-06-17,"An Act To Increase Prescription Drug Pricing Transparency","An Act To Increase Prescription Drug Pricing Transparency",0,,2021-06-17,"PASSED TO BE ENACTED, in concurrence.",https://legiscan.com/ME/bill/LD686/2021,https://legislature.maine.gov/legis/bills/display_ps.asp?LD=686&snum=130
